{
  "schema_version": "1",
  "environment": "devnet",
  "role": "full-node",
  "suite": {
    "sig_suite_id": 100,
    "sig_suite": "ml-dsa-44",
    "kem_suite_id": 100,
    "kem_suite": "ml-kem-768"
  },
  "node_id": "0000000000000000000000000000000000000000000000000000000000000000",
  "node_id_short": "0000000000000000",
  "peer_id": "0000000000000000000000000000000000000000000000000000000000000000",
  "leaf_cert_fingerprint": "1111111111111111111111111111111111111111111111111111111111111111",
  "leaf_cert_fingerprint_short": "11111111",
  "root_key_id": "2222222222222222222222222222222222222222222222222222222222222222",
  "root_pk_fingerprint": "22222222",
  "trusted_root_spec": "2222222222222222222222222222222222222222222222222222222222222222:100:abcdef0123456789",
  "validator_address": null,
  "transport_security_mode": "kemtls-mutual-auth-required",
  "pqc_suite": "ml-dsa-44",
  "private_material": {
    "leaf_cert_path": "/path/to/operator-selected-tmp/full-node/leaf.cert.bin",
    "leaf_kem_sk_path": "/path/to/operator-selected-tmp/full-node/leaf.kem.sk.bin",
    "note": "leaf_kem_sk and the root signing key are SECRET and must NEVER be published; this block records paths only, not contents"
  },
  "safety_label": {
    "experimental": true,
    "resettable": true,
    "no_value": true,
    "no_mainnet_readiness_claim": true,
    "no_c4_c5_closure_claim": true
  },
  "devnet_only": true
}